{
  "version": 2,
  "missionId": "mission-531ac553",
  "missionName": "unnamed-mission",
  "status": "active",
  "createdAt": "2026-09-06T10:40:40.705Z",
  "updatedAt": "2026-09-06T22:14:20.348Z",
  "impact": {
    "operatorDeclared": null,
    "runtimeDetected": null,
    "effective": null
  },
  "requirements": [
    {
      "id": "req-50f8a48b",
      "text": "TEST PROBE - delete me",
      "nonRequirements": [],
      "acceptanceCriteria": [
        {
          "id": "ac-324299de",
          "text": "probe criterion",
          "evidenceIds": [],
          "status": "open"
        }
      ],
      "createdAt": "2026-09-06T10:41:05.273Z"
    },
    {
      "id": "req-a10f4e6f",
      "text": "TEST PROBE 2",
      "nonRequirements": [
        "nr2"
      ],
      "acceptanceCriteria": [],
      "createdAt": "2026-09-06T10:41:23.318Z"
    },
    {
      "id": "req-2e49ae7d",
      "text": "Deliver a single consolidated end-to-end systemic audit report covering architecture, database, backend, contracts, frontend, security, distributed systems, integrations, dependencies/supply-chain, test strategy, documentation accuracy, reliability/observability, performance, UI/UX, accessibility, adversarial/residual findings, and git/repo integrity for MUSIC OS 360.",
      "nonRequirements": [
        "No fixes, refactors, migrations, or code edits are implemented or committed as part of this mission; deliverable is analysis plus a proposed, NOT-executed implementation plan. The pre-existing uncommitted naming-normalization diff (per git status at mission start) and its already-landed PT->EN rename commits are read-only context and must not be staged, unstaged, committed, reset, or otherwise modified by this mission."
      ],
      "acceptanceCriteria": [
        {
          "id": "ac-f5021468",
          "text": "Final report contains one consolidated document including: coverage ledger, architecture/domain map, source-of-truth map, writer/reader matrix for material entities, producer/consumer/contract map, canonical naming findings classified by type, findings by severity with file:line evidence, security findings, residual-audit results, AI-skills/agent-pack capability map, and a prioritized implementation plan.",
          "evidenceIds": [],
          "status": "open"
        },
        {
          "id": "ac-36450436",
          "text": "git status --short and git diff captured at end of mission are identical to the snapshot captured at mission start (no files staged/unstaged/committed/reset by this mission's activity).",
          "evidenceIds": [],
          "status": "open"
        },
        {
          "id": "ac-cc5555e8",
          "text": "The report contains zero applied code diffs; the plan section is explicitly labeled NOT EXECUTED / PENDING AUTHORIZATION.",
          "evidenceIds": [],
          "status": "open"
        }
      ],
      "createdAt": "2026-09-06T10:43:59.700Z"
    },
    {
      "id": "req-e08b8bcb",
      "text": "Audit the in-progress PT->EN naming normalization (titulo/title, tipo/type, data_inicio/data_fim->start_date/end_date, obra_id->work_id, documentos->documents, client/project/campaign/release FK families) for completeness and consistency across DB, backend, and frontend.",
      "nonRequirements": [
        "This mission does not perform additional renames or edits; it only verifies claims already recorded in NAMING_NORMALIZATION_CANONICAL_MAP.md against current code/DB state and reports gaps."
      ],
      "acceptanceCriteria": [
        {
          "id": "ac-4392871b",
          "text": "Every canonical rename pair listed in NAMING_NORMALIZATION_CANONICAL_MAP.md is checked by repo-wide search against apps/api/src, apps/web/src, and migrations/entities, and classified as fully-migrated, partially-migrated (with file:line holdouts listed), or not-migrated.",
          "evidenceIds": [],
          "status": "open"
        },
        {
          "id": "ac-9dd0b46f",
          "text": "Report includes a source-of-truth map naming, per renamed concept, which layer (DB column, TypeORM entity, DTO, frontend type) is authoritative and which are stale/duplicated definitions.",
          "evidenceIds": [],
          "status": "open"
        },
        {
          "id": "ac-acf47062",
          "text": "Every residual PT-named field, column, or variable still referenced in live (non-test, non-comment) code is reported with file path and line number.",
          "evidenceIds": [],
          "status": "open"
        }
      ],
      "createdAt": "2026-09-06T10:44:11.280Z"
    },
    {
      "id": "req-3b5d915f",
      "text": "Produce an architecture and domain map of MUSIC OS 360 covering every module in apps/api/src/modules and apps/web/src/modules, plus packages/*.",
      "nonRequirements": [],
      "acceptanceCriteria": [
        {
          "id": "ac-97ad9f4d",
          "text": "Report includes a module/domain map covering every top-level directory under apps/api/src/modules, apps/web/src/modules, and packages/*, each with stated responsibility and its known dependents.",
          "evidenceIds": [],
          "status": "open"
        },
        {
          "id": "ac-d4b5d436",
          "text": "Coverage ledger lists every module/directory that was audited versus explicitly skipped-with-reason; no module is silently omitted from the ledger.",
          "evidenceIds": [],
          "status": "open"
        }
      ],
      "createdAt": "2026-09-06T10:44:15.564Z"
    },
    {
      "id": "req-e0f2f1c2",
      "text": "Audit database schema and multi-tenant isolation guarantees across all tenant-scoped entities in apps/api.",
      "nonRequirements": [],
      "acceptanceCriteria": [
        {
          "id": "ac-6c5d9a09",
          "text": "Every entity/table with a tenant-scoped column is classified as DB-enforced (FK/RLS/unique-with-tenant constraint) or application-only enforced, with file:line/migration evidence for the classification.",
          "evidenceIds": [],
          "status": "open"
        },
        {
          "id": "ac-f2af3b70",
          "text": "Every TypeORM repository or query-builder call found not scoped by tenant id is listed by file:line, or the report states explicitly that a repo-wide search found none and describes the search method used.",
          "evidenceIds": [],
          "status": "open"
        },
        {
          "id": "ac-ba8976d4",
          "text": "Migration history is diffed against current entity definitions for at least the tables touched by the in-progress naming normalization, reporting any drift between committed migrations and entity code.",
          "evidenceIds": [],
          "status": "open"
        }
      ],
      "createdAt": "2026-09-06T10:44:25.154Z"
    },
    {
      "id": "req-6d142b12",
      "text": "Audit API/DTO contracts between apps/api controllers and apps/web TanStack Query consumers for drift.",
      "nonRequirements": [],
      "acceptanceCriteria": [
        {
          "id": "ac-0f33f95b",
          "text": "A producer/consumer/contract map is produced for every REST endpoint exposed by apps/api, comparing the NestJS DTO/response shape against the actual frontend call/type shape, flagging every field-name or type mismatch with file:line on both sides.",
          "evidenceIds": [],
          "status": "open"
        },
        {
          "id": "ac-22d6ec31",
          "text": "Every contract mismatch found is classified by severity (breaking / silent-fallback / cosmetic).",
          "evidenceIds": [],
          "status": "open"
        }
      ],
      "createdAt": "2026-09-06T10:44:33.039Z"
    },
    {
      "id": "req-b7d533b2",
      "text": "Audit distributed-systems correctness of BullMQ queues/processors in apps/api: idempotency, retries, and failure handling.",
      "nonRequirements": [],
      "acceptanceCriteria": [
        {
          "id": "ac-2bf221d1",
          "text": "Every BullMQ queue/processor is inventoried with its idempotency mechanism (or none found), retry/backoff configuration, and dead-letter/failure handling, each with file:line evidence.",
          "evidenceIds": [],
          "status": "open"
        },
        {
          "id": "ac-9dd0a707",
          "text": "Every job handler performing a mutating operation without an identifiable idempotency guard is reported as a finding with an assigned severity.",
          "evidenceIds": [],
          "status": "open"
        }
      ],
      "createdAt": "2026-09-06T10:44:43.273Z"
    },
    {
      "id": "req-069f8cc2",
      "text": "Audit external platform integrations (Spotify, Soundcharts, and any other providers under apps/api/src/modules/artists/platform-profiles/providers and elsewhere) for auth, rate-limiting, and error handling.",
      "nonRequirements": [
        "Verification is read-only; no live external API calls requiring write credentials are made during the audit."
      ],
      "acceptanceCriteria": [
        {
          "id": "ac-70cd55b0",
          "text": "Every external provider integration is inventoried with its auth method, rate-limit handling, and error/retry handling, each with file:line evidence.",
          "evidenceIds": [],
          "status": "open"
        },
        {
          "id": "ac-771ef549",
          "text": "The currently unresolved-merge-conflict and staged files in the platform-profiles module (artist-external-profile-sync.service.ts, spotify-artist-profile.provider.ts/.spec.ts, ArtistaPlatformMetrics.tsx and its test, per git status at mission start) are reviewed and their conflicted/staged state is documented in the report without being resolved.",
          "evidenceIds": [],
          "status": "open"
        }
      ],
      "createdAt": "2026-09-06T10:44:47.771Z"
    },
    {
      "id": "req-fd43b914",
      "text": "Audit dependency and supply-chain risk across apps/api, apps/web, and packages/* (vulnerable, unpinned, or abandoned packages).",